row_id,idFinal,source_text,reference_text,idcod,atr0,atr1,atr2,atr3,atr4,atr5,atr6,atr7,atr8,lex
3559,324_LibroUAC_Sincopyright.pdf,"En el funcionamiento de la economía de mercado, el sistema financiero relaciona a productores y comerciantes de bienes con clientes y consumidores.","En la economía de mercado, el sistema financiero relaciona a productores y comerciantes de productos con clientes y consumidores.",Vivian,1.0,5.0,,,,,,,,1
3561,327_LibroUAC_Sincopyright.pdf,"En el sistema financiero, donde se desenvuelven las empresas, un factor de desarrollo muy importante es el crédito.",El crédito es un factor de desarrollo muy importante en el sistema financiero.,Vivian,5.0,19.0,,,,,,,,0
3564,331_LibroUAC_Sincopyright.pdf,En el siguiente cuadro destacamos algunas de las más importantes.,El siguiente cuadro mencionamos algunas.,Vivian,5.0,3.0,,,,,,,,0
3566,342_LibroUAC_Sincopyright.pdf,"Y agrega que la administración financiera incluye, fundamentalmente, procesos financieros, administrativos y de control relacionados con el gobierno central, el nivel municipal y las instituciones y empresas del Estado.","La administración financiera también incluye procesos financieros, administrativos y de control relacionados con el gobierno central, municipal y estatal.",Vivian,5.0,6.0,,,,,,,,0
3571,360_LibroUAC_Sincopyright.pdf,Postulados académicos indican que los ingresos monetarios de las personas son de dos tipos: los ingresos ordinarios y los ingresos extraordinarios (también vale para las empresas).,Según los principios académicos los ingresos monetarios son de dos tipos: ordinarios y extraordinarios.,Vivian,6.0,5.0,1.0,,,,,,,1
3575,375_LibroUAC_Sincopyright.pdf,"Es el primer, y a veces único, destino que tienen los ingresos.",Es el primer destino de los ingresos.,Vivian,17.0,5.0,,,,,,,,0
3578,378_LibroUAC_Sincopyright.pdf,"Para que el ahorro sea productivo hay que invertirlo, de otro modo pierde valor en el tiempo.",Debemos invertir el ahorro para que sea productivo.,Vivian,19.0,18.0,5.0,,,,,,,0
3584,390_LibroUAC_Sincopyright.pdf,"Seguramente, los adultos mayores recuerden las compras «al fiado» en el negocio o carnicería de la esquina.",Los adultos mayores pueden recordar las compras fiadas en negocios cercanos.,Vivian,4.0,21.0,5.0,,,,,,,0
3591,399_LibroUAC_Sincopyright.pdf,"El crédito o deuda está siempre asociado a un interés que cobra el prestamista (banco, institución financiera, comercio, entre otros), cuyas tasas fluctúan en el mercado financiero y comercial dependiendo del tipo de crédito.",El crédito o deuda se relaciona a un interés cobrado por el prestamista. Sus tasas cambian en el mercado financiero y comercial según el tipo de crédito.,Vivian,16.0,9.0,12.0,17.0,,,,,,0
3596,414_LibroUAC_Sincopyright.pdf,"El PIB por habitante alcanzó alrededor de US$25.000, lo que representa el valor que le correspondería a cada persona si se repartiera el monto total de los recursos, es decir, 477.000 millones dividido por los 18,5 millones de habitantes del país, según censo de 2018.",El Producto Interno Bruto por habitante alcanzó casi veinticinco mil dólares. Esto representa el valor para cada persona si se repartiera el total de los recursos.,Vivian,13.0,14.0,9.0,15.0,5.0,,,,,0
3599,420_LibroUAC_Sincopyright.pdf,La UTM unidad tributaria mensual es un índice para expresar el valor monetario de los impuestos.,La unidad tributaria mensual expresa el valor monetario de los impuestos.,Vivian,13.0,5.0,,,,,,,,0
3613,693_LibroUAC_Sincopyright.pdf,"El siguiente recuadro muestra los montos de la balanza chilena (en millones de dólares) para cuatro años sucesivos a precios FOB (costos, seguro y flete en puertos de origen).",El siguiente cuadro tiene los montos de la balanza chilena para cuatro años sucesivos.,Vivian,5.0,4.0,1.0,,,,,,,1
3614,694_LibroUAC_Sincopyright.pdf,La última columna indica la diferencia favorable entre los flujos de ingresos por exportaciones menos los flujos de egresos por el pago de importaciones.,La última columna tiene la diferencia positiva entre los ingresos por exportaciones menos los pagos de impuestos.,Vivian,5.0,1.0,,,,,,,,1
3625,722_LibroUAC_Sincopyright.pdf,"Es como una fotografía tomada en un determinado momento pues muestra lo que se tiene y lo que se debe en ese instante, que puede ser el fin del mes, del semestre o a fines de año.","Presenta las pertenencias y las deudas de fin de mes, de semestre o de año.",Vivian,5.0,1.0,17.0,,,,,,,1
3638,738_LibroUAC_Sincopyright.pdf,"entre ellos se destacan: indicadores macroeconómicos IPC índice de precios al por menor, se emplea para medir la inflación mensual de una canasta familiar IPM índice de precios al por mayor, aplica para medir inflación en operaciones comerciales.",Entre ellos están los indicadores macroeconómicos. El Índice de precios al por menor que mide la inflación mensual de una canasta familiar. El Índice de precios al por mayor que mide la inflación en transacciones comerciales.,Vivian,15.0,5.0,13.0,6.0,1.0,,,,,1
3639,741_LibroUAC_Sincopyright.pdf,Precio de la libra de cobre informa diariamente del precio de la libra de cobre en los mercados internacionales precio del dólar valor del dólar con relación al peso chileno.,Precio de la libra de cobre informa diariamente del valor de esta en los mercados internacionales. El precio del dólar es el valor del dólar respecto del peso chileno.,Vivian,15.0,6.0,,,,,,,,0
3643,750_LibroUAC_Sincopyright.pdf,"Usados en remuneraciones contratos de trabajo liquidaciones de sueldo boletas de honorarios finiquitos de trabajo formularios de declaración previsional usados en impuestos inicio de actividades término de giro formulario de declaración y pago mensual formulario de declaración y pago anual usados en contabilidad libro diario, mayor y balance libros de compras y de ventas libros de remuneraciones libro de accionistas.","Usados en pagos como los contratos de trabajo, pago de salarios, boletas de honorarios, despido, formularios de declaración previsional.                   Usados en impuestos como inicio de actividades, fin de giro, formulario de declaración y pago mensual. Declaración y pago anual.                                      Usados en contabilidad como libro diario. Mayor y balance. Libros de compras y de ventas. Libros de pagos. Libros de accionistas.",Vivian,1.0,15.0,6.0,,,,,,,1
3646,753_LibroUAC_Sincopyright.pdf,"El Código de Comercio, en su artículo 44 establece que «los comerciantes deben conservar los libros de su giro hasta que termine de todo punto la liquidación de sus negocios».",El Código de comercio establece en su Artículo cuarenta y cuatro: Los comerciantes deben guardar los libros de su giro hasta terminar la liquidación de su empresa.,Vivian,5.0,21.0,14.0,1.0,,,,,,1
3647,754_LibroUAC_Sincopyright.pdf,"El Código Tributario, por su parte, señala, en su artículo 17, inciso 2.°, que «los libros de contabilidad deben ser conservados por los contribuyentes, junto con la documentación correspondiente, mientras esté pendiente el plazo que tiene el servicio de impuestos internos para la revisión de las declaraciones».",El Código Tributario en el artículo diecisiete establece: Los contribuyentes deben conservar los libros de contabilidad y los documentos durante el plazo de revisión de declaraciones del servicio de impuestos.,Vivian,21.0,15.0,5.0,6.0,14.0,1.0,19.0,,,1
3648,756_LibroUAC_Sincopyright.pdf,Estos plazos de prescripción están contenidos en el artículo 200 de este mismo Código y son:,Estos plazos están en artículo doscientos de ese Código:,Vivian,5.0,6.0,14.0,,,,,,,0
3649,757_LibroUAC_Sincopyright.pdf,"Tres años desde el vencimiento del impuesto respectivo, como norma general.",La regla general son tres años desde el vencimiento del impuesto.,Vivian,19.0,5.0,1.0,,,,,,,1
3653,767_LibroUAC_Sincopyright.pdf,¿Qué función cumplen las empresas en la sociedad?,¿Qué función tienen las empresas en la sociedad?,Vivian,21.0,1.0,,,,,,,,1
3655,771_LibroUAC_Sincopyright.pdf,"¿Cómo se fijan los precios, el costo y la utilidad?","¿Cómo se establecen los precios, el costo y la ganancia?",Vivian,1.0,21.0,,,,,,,,1
3657,775_LibroUAC_Sincopyright.pdf,¿En qué consisten las inversiones y cómo se financian?,¿Qué son las inversiones? ¿Cómo se financian?,Vivian,15.0,21.0,,,,,,,,0
3671,814_LibroUAC_Sincopyright.pdf,Lo paga el consumidor final todos nosotros mientras que las empresas actúan de intermediarios entre el consumidor y el fisco.,Lo pagamos todos. Las empresas son intermediarios entre el consumidor y el fisco.,Vivian,6.0,15.0,16.0,,,,,,,0
3675,818_LibroUAC_Sincopyright.pdf,"En cambio, los comerciantes (quienes venden, sean personas o empresas) emiten o reciben facturas por sus ventas y sus compras, donde separan el valor de la mercancía del valor del impuesto y ello determina, cada mes, un saldo a favor del fisco (débito mayor que crédito) o del comerciante (débito menor que crédito).","En cambio, los comerciantes dan o reciben facturas por sus ventas y compras. Donde separan el precio del producto del impuesto. Esto determina mensualmente un saldo a favor del fisco o del comerciante.",Vivian,6.0,1.0,15.0,5.0,,,,,,1
3677,821_LibroUAC_Sincopyright.pdf,"Si compras un kilo de pan en $1.190 y el IVA está incluido en el precio, pero quieres saber cuánto vale el pan y cuánto es el IVA debes dividir el monto total por 1,19 (1.000) lo que dará 1.","Cuando compras un kilo de pan en mil ciento noventa pesos con el impuesto al valor agregado incluido, este es de un peso. Para saber cuánto vale el pan y cuánto es el impuesto divide el total por uno coma diecinueve.",Vivian,5.0,14.0,13.0,,,,,,,0
3691,847_LibroUAC_Sincopyright.pdf,"La tasa general de impuesto es de 25 % o 27,5 % del monto de la utilidad (vigente desde 2018 según el régimen tributario del contribuyente).",La tasa general de impuesto es de veinticinco o veintisiete coma cinco por ciento de la ganancia.,Vivian,5.0,14.0,,,,,,,,0
3692,850_LibroUAC_Sincopyright.pdf,"Se paga al fisco en el primer cuatrimestre del año siguiente al de la utilidad, aunque las empresas deben cancelar mensualmente una parte a cuenta, proceso denominado Pagos Provisionales Mensuales o PPM.",Se paga al fisco en el primer cuatrimestre del año siguiente al de la ganancia. Las empresas deben pagar mensualmente una parte a cuenta. Esto se llama Pagos Provisionales Mensuales.,Vivian,15.0,1.0,13.0,,,,,,,1
3694,855_LibroUAC_Sincopyright.pdf,Se llama también Impuesto Único a los Trabajadores (IUT).,También llamado Impuesto Único a los Trabajadores.,Vivian,6.0,13.0,,,,,,,,0
3696,857_LibroUAC_Sincopyright.pdf,Los sueldos o pensiones que superen ese monto pagan impuestos con tasas desde 4 % en el segundo tramo y que aumentan progresivamente hasta llegar al 40 % en el octavo y último tramo para ingresos sobre las 120 UTM.,Los salarios superiores a ese monto pagan impuestos con tasas desde cuatro por ciento en la segunda etapa. Aumentan progresivamente hasta llegar al cuarenta por ciento en la octava y última etapa para ingresos sobre las ciento veinte unidades tributarias mensuales.,Vivian,15.0,14.0,5.0,1.0,17.0,,,,,1
3699,877_LibroUAC_Sincopyright.pdf,"Retenciones sobre los honorarios. Hasta hace poco, las empresas le descontaban a los trabajadores inde-pendientes el  10 %  de los ingresos (honorarios) en calidad de PPM, el que pagaban al fisco junto al IUT .",Retenciones sobre los honorarios. Las empresas les descontaban a los trabajadores independientes el diez por ciento de los ingresos en calidad de pagos provisionales mensuales. Lo pagaban al fisco con el impuesto único a los trabajadores.,Vivian,5.0,14.0,13.0,17.0,,,,,,0
3706,889_LibroUAC_Sincopyright.pdf,Impuesto global complementario (IGC) es un impuesto resumen que afecta a todas las rentas de las personas provengan del capital o del trabajo.,Impuesto global complementario es un impuesto resumen sobre las rentas de las personas provenientes del capital o trabajo.,Vivian,13.0,17.0,6.0,,,,,,,0
3719,2049_LibroBAC.pdf,"La Macroeconomía, por otro lado, es la rama de la economía especializada en estudiar el comportamiento de los grandes agregados.","Por otro lado, la Macroeconomía es la rama de la economía especializada en estudiar el comportamiento de los grandes agregados.",Fiorella,19.0,,,,,,,,,0
3720,2054_LibroBAC.pdf,"En todo caso, la Microeconomía y la Macroeconomía están estrechamente vinculadas y relacionadas entre sí.","En todo caso, la Microeconomía y la Macroeconomía están estrechamente relacionadas entre sí.",Fiorella,5.0,,,,,,,,,0
3732,7612_LibroBAC.pdf,Aprender a comprar: aprovechar ofertas.,"Aprender a comprar como, por ejemplo, al aprovechar ofertas.",Fiorella,3.0,,,,,,,,,0
3776,11662_LibroBAC.pdf,"Hable con ellos, déles la cara, y hágales saber que está haciendo todo lo que puede para pagarles.","Hable con ellos, enfréntelos y comuníqueles que está haciendo lo posible para pagarles.",Fiorella,6.0,,,,,,,,,0
3777,11670_LibroBAC.pdf,"Para otros gastos como ropa y calzado, diversión, se debe estimar un gasto mensual.","Se debe estimar un gasto mensual para otros gastos, como ropa, calzado y diversión.",Fiorella,19.0,,,,,,,,,0
3779,15438b_LibroBAC.pdf,"Como ya lo dijimos, los seguros son otro elemento digno de conocer en el ámbito de la educación financiera ciudadana.","Según lo dicho, los seguros son otro elemento digno de conocer respecto la educación financiera ciudadana.",Fiorella,6.0,,,,,,,,,0
3784,15569_LibroBAC.pdf,La suma asegurada podrá mantener estable o constante o podrá variar según el comportamiento inflacionario.,La suma asegurada podrá mantenerse constante o variar según el comportamiento inflacionario.,Fiorella,5.0,,,,,,,,,0
3785,15576_LibroBAC.pdf,Hay aseguradoras que lo establecen mensualmente y otras semestral o anualmente.,Algunas aseguradoras lo establecen mensualmente y otras semestral o anualmente.,Fiorella,7.0,,,,,,,,,0
3796,640_LibroNEFE_Sincopyright.pdf,Crea recordatorios para registrar los pagos automáticos en el plan de gastos o en el presupuesto cuando se efectúen.,Crea recordatorios para registrar los pagos automáticos en el presupuesto cuando se efectúen.,Fiorella,5.0,,,,,,,,,0
3797,646_LibroNEFE_Sincopyright.pdf,"Con un sueldo menos y gastos adicionales, el dinero escaseaba.",El dinero escaseaba con un sueldo menos y gastos adicionales.,Fiorella,19.0,,,,,,,,,0
3799,691_LibroNEFE_Sincopyright.pdf,Suma los montos de todos los depósitos que todavía no se registraron en tu cuenta.,Suma los montos de todos los depósitos no registrados todavía en tu cuenta.,Fiorella,6.0,,,,,,,,,0
3800,705_LibroNEFE_Sincopyright.pdf,¿Existe un límite para la cantidad de retiros de dinero que puedo hacer desde mi cuenta cada mes sin tener que pagar cargos?,¿Existe un límite para la cantidad de retiros mensuales que puedo hacer sin pagar cargos?,Fiorella,5.0,,,,,,,,,0
3807,781_LibroNEFE_Sincopyright.pdf,Los inversores tienen que equilibrar las tasas de retorno más altas con los mayores riesgos.,Los inversores equilibran las tasas de retorno elevadas con los mayores riesgos.,Fiorella,6.0,,,,,,,,,0
3814,597_LibroUAC_Sincopyright.pdf,"Se expresa en porcentajes o, en fórmulas, como número decimal.","Se expresa en porcentajes o en fórmulas, como número decimal.",Fiorella,3.0,,,,,,,,,0
3816,616_LibroUAC_Sincopyright.pdf,"POR EJEMPLO, LAS DEUDAS POR CRÉDITOS.","Por ejemplo, las deudas por créditos.",Fiorella,3.0,,,,,,,,,0
3819,629_LibroUAC_Sincopyright.pdf,Pero ¿en qué se compite?,Pero ¿en qué se compite?,Fiorella,,,,,,,,,,0
3821,646_LibroUAC_Sincopyright.pdf,"Igualmente, existen niveles intermedios entre monopolio y competencia, entre ellos los mercados de monopsonios, oligopolios y carteles empresariales.","Igualmente, existen niveles intermedios entre monopolio y competencia, como monopsonios, oligopolios y carteles empresariales.",Fiorella,6.0,,,,,,,,,0
3827,683_LibroUAC_Sincopyright.pdf,"Además, Las exportaciones no pagan IVA.","Además, las exportaciones no pagan el impuesto al valor agregado.",Fiorella,13.0,,,,,,,,,0
3831,609_LibroBAC.pdf,"""Para el éxito del programa es necesario considerar la capacitación de profesores y profesoras, no sólo para acciones directas con el alumnado, sino que se pueden realizar acciones de capacitación de líderes estudiantiles.","Es necesario considerar la capacitación de profesores y profesoras para el éxito del programa. No sólo para acciones directas con el alumnado, también para realizar acciones de capacitación de líderes estudiantiles.",María Annette,19.0,,,,,,,,,0
3841,854_LibroBAC.pdf,Es importante que sus años dorados realmente sean dorados y no una ilusión sin sustento financiero.,Es importante que sus años de retiro sean de provecho y no una ilusión sin sustento financiero.,María Annette,2.0,,,,,,,,,0
3845,3711_LibroBAC.pdf,"Veamos, ahora sí, con más detalle, cada uno de los factores de producción.",Veamos con más detalle cada uno de los factores de producción.,María Annette,16.0,,,,,,,,,0
3847,3718_LibroBAC.pdf,"En ciencias humanas se utiliza para implicar una transformación del ambiente llevada a cabo por el hombre, con ciertos propósitos.",En ciencias humanas se utiliza para implicar una transformación del ambiente llevada a cabo por el hombre con ciertos propósitos.,María Annette,16.0,,,,,,,,,0
3850,3724_LibroBAC.pdf,"Sólo el hombre trabaja y, como lo ha indicado la filosofía marxista, el trabajo contribuye en forma muy importante a la transformación del animal en hombre.","Sólo el hombre trabaja, el trabajo contribuye en forma muy importante a la transformación del animal en hombre de acuerdo a la filosofía marxista.",María Annette,16.0,,,,,,,,,0
3852,5209_LibroBAC.pdf,¿Cuánta alegría proporciona el dinero? se pregunta Suárez.,¿Cuánta alegría proporciona el dinero? Se pregunta Suárez.,María Annette,18.0,,,,,,,,,0
3853,5220_LibroBAC.pdf,La gente común tiene claro que el dinero en algo influye.,La gente común tiene claro que el dinero influye.,María Annette,2.0,,,,,,,,,0
3856,5225_LibroBAC.pdf,"El individuo contento con su ingreso vive dentro de sus medios sin endeudarse en exceso, el que está contento con su auto no se compra uno más caro que le va a costar pagar.",El individuo contento con su ingreso vive dentro de sus medios sin endeudarse en exceso. El que está contento con su auto no se compra uno más caro que le va a costar pagar.,María Annette,3.0,,,,,,,,,0
3859,5235_LibroBAC.pdf,"Te sorprenderás de cómo crecen tus ahorros con tan solo un cinco, incluso un dos por ciento mensual.",Te sorprenderá cómo crecen tus ahorros con tan solo un cinco o incluso un dos por ciento mensual.,María Annette,5.0,,,,,,,,,0
3862,5258_LibroBAC.pdf,Alguien sostiene que el origen de toda gran fortuna es una pequeña fortuna y nunca se va a tener la oportunidad de aprender a administrar un millón de dólares si antes no se aprende a administrar.,Alguien sostiene que el origen de toda gran fortuna es una pequeña fortuna y nunca se va a tener la oportunidad de aprender a administrar un millón de dólares si antes no se aprende a administrar un dólar.,María Annette,3.0,,,,,,,,,0
3863,5262_LibroBAC.pdf,"Como lo dice Yager: La mayoría de la producción de las economías capitalistas nace directamente de un hombre casado que trabaja por su familia, que construye la seguridad para su esposa y los hijos.","Como dice Yager, la mayoría de la producción de las economías capitalistas nace directamente de un hombre casado que trabaja por su familia, que construye la seguridad para su esposa y los hijos.",María Annette,3.0,,,,,,,,,0
3865,5274_LibroBAC.pdf,"Por consiguiente, compran los bienes y servicios que necesitan, hasta donde sus ingresos mismos se los permita.","Por consiguiente, compran los bienes y servicios que necesitan hasta donde sus ingresos mismos se los permita.",María Annette,16.0,,,,,,,,,0
3867,5292_LibroBAC.pdf,"Deudas: Estas son las sumas totales adeudadas a bancos o instituciones financieras por concepto de préstamos para compra de casa, vehículos o tarjetas de crédito y/o cualquier otro préstamo personal.","Deudas: Estas son las sumas totales adeudadas a bancos o instituciones financieras por concepto de préstamos para compra de casa, vehículos o tarjetas de crédito o cualquier otro préstamo personal.",María Annette,2.0,,,,,,,,,0
3872,7472_LibroBAC.pdf,"Antes de elaborar un presupuesto, como previamente lo señalamos, que implica necesariamente referirse al factor dinero, hay que trabajar en lo que algunos autores denominan Planeación de Vida.","Antes de elaborar un presupuesto que implica necesariamente referirse al factor dinero, hay que trabajar en lo que algunos autores denominan Planeación de Vida.",María Annette,16.0,,,,,,,,,0
3878,7528_LibroBAC.pdf,"Usted puede planear estas metas con bastante exactitud, y puede comprobar fácilmente si está teniendo éxito en el camino hacia ellas con el paso de las semanas.",Usted puede planear estas metas con bastante exactitud y comprobar fácilmente si está teniendo éxito con el paso de las semanas.,María Annette,5.0,,,,,,,,,0
3890,7771_LibroBAC.pdf,"En tu presupuesto debes poner en el rubro de ahorro una cantidad fija mensual, la cual depositarás en tu banco y harás de cuenta que ese dinero ya lo gastaste.","En tu presupuesto debes poner en el rubro de ahorro una cantidad fija mensual, la cual depositarás en tu banco y harás de cuenta que ese dinero ya lo gastaste.",María Annette,3.0,,,,,,,,,0
3891,7774_LibroBAC.pdf,"Por tanto, no existen, pues ya se gastaron.","Por tanto, no existen pues ya se gastaron.",María Annette,16.0,,,,,,,,,0
3896,10270_LibroBAC.pdf,"Por esta razón, cada inversionista debe determinar cuánto riesgo está dispuesto a asumir con el fin de obtener una mayor rentabilidad por su inversión, y con base en esta evaluación, decidir en cuáles instrumentos invertir.","Por esta razón, cada inversionista debe determinar cuánto riesgo está dispuesto a asumir con el fin de obtener una mayor rentabilidad por su inversión, y con base en esta evaluación decidir en cuáles instrumentos invertir.",María Annette,16.0,,,,,,,,,0
3899,10274_LibroBAC.pdf,"Para ilustrarlo, supongamos que se compra un bono de $1,000 a un año plazo con una tasa de interés del 5%.","Para ilustrarlo, supongamos que se compra un bono de mil dólares a un año plazo con una tasa de interés del cinco por ciento.",María Annette,14.0,,,,,,,,,0
3906,10431_LibroBAC.pdf,"En este campo, los instrumentos de inversión permiten la adquisición de propiedades, la participación por medio de acciones o la creación de una empresa o negocio y la puesta en marcha de proyectos específicos, especialmente cuando existe necesidad de capitales para el logro de sus objetivos y metas.","En este campo, los instrumentos de inversión permiten la adquisición de propiedades, la participación por medio de acciones o la creación de una empresa o negocio. También la puesta en marcha de proyectos específicos, especialmente cuando existe necesidad de capitales para el logro de sus objetivos y metas.",María Annette,15.0,,,,,,,,,0
3907,10435_LibroBAC.pdf,"En este caso, si se realiza la adquisición, prácticamente se obtiene una ganancia sólo al compararlo con los precios del mercado.","En este caso, si se realiza la adquisición también se obtiene una ganancia sólo al compararlo con los precios del mercado.",María Annette,16.0,,,,,,,,,0
3911,10441_LibroBAC.pdf,"Con el tiempo, la propiedad aumenta de valor y si se decide venderla se obtiene una utilidad que, por lo general, representa una rentabilidad mayor que muchos otros instrumentos de inversión.","Con el tiempo, la propiedad aumenta de valor y si se decide venderla se obtiene una utilidad que por lo general representa una rentabilidad mayor que muchos otros instrumentos de inversión.",María Annette,16.0,,,,,,,,,0
3918,10508_LibroBAC.pdf,"Un fondo de inversión, es un patrimonio formado por el ahorro de muchos inversionistas, que es administrado en nombre de ellos por un grupo de profesionales en materia de inversiones.",Un fondo de inversión es un patrimonio formado por el ahorro de muchos inversionistas que es administrado en nombre de ellos por un grupo de profesionales en materia de inversiones.,María Annette,16.0,,,,,,,,,0
3919,10510_LibroBAC.pdf,"Por esa razón, su inversión depende de lo que ocurra con el precio de los títulos que en su nombre ha comprado el fondo de inversión.","Por esa razón, su inversión depende de lo que ocurra con el precio de los títulos que ha comprado el fondo de inversión en su nombre.",María Annette,19.0,,,,,,,,,0
3930,10523_LibroBAC.pdf,"Cuanto mayor sea el plazo que le falta al bono para llegar a su vencimiento, mayor será el efecto de los cambios en la tasa de interés sobre su precio, ya que el flujo de intereses tiene un mayor peso en el valor actual del bono.","Cuanto mayor sea el plazo que le falta al bono para llegar a su vencimiento mayor será el efecto de los cambios en la tasa de interés sobre su precio, ya que el flujo de intereses tiene un mayor peso en el valor actual del bono.",María Annette,16.0,,,,,,,,,0
3947,10611_LibroBAC.pdf,"Liquidez que se logra planeando adecuadamente sus inversiones, a corto, mediano y largo plazo, para contar con recursos financieros cuando se requieran.","Liquidez que se logra planeando adecuadamente sus inversiones a corto, mediano y largo plazo para contar con recursos financieros cuando se requieran.",María Annette,16.0,,,,,,,,,0
