row_id,idFinal,source_text,reference_text,idcod,atr0,atr1,atr2,atr3,atr4,atr5,atr6,atr7,atr8,lex
2175,2110_LibroBAC.pdf,"La Economía es una disciplina, científica hoy, que prácticamente remonta sus orígenes al inicio de la comunidad humana misma, la cual empieza con las hordas primitivas, que son resultante de la conciencia que toma el ser humano de enfrentar en colectivos los desafíos de la naturaleza.",La Economía es una disciplina científica originada al inicio de la comunidad humana debido a los retos presentados por la naturaleza.,Vivian,17.0,16.0,5.0,,,,,,,0
2179,2116_LibroBAC.pdf,"Finalmente, el consumo es la utilización que se le da a un bien o servicio, que es la finalidad última de toda la actividad económica.","Finalmente, el consumo es la utilización dada a un bien o servicio.",Vivian,5.0,17.0,,,,,,,,0
2183,2125_LibroBAC.pdf,"Dado que tanto en la vida diaria como en las cuestiones nacionales hay aspectos económicos, es esencial que los individuos y los países posean unos conocimientos básicos de economía para tomar decisiones financieras sensatas.","Debido a la influencia de los aspectos económicos en la vida diaria, los individuos deben tener conocimientos básicos para tomar decisiones financieras sensatas.",Vivian,5.0,17.0,19.0,,,,,,,0
2184,3513_LibroBAC.pdf,"En Economía, los conceptos de trabajo y productividad, que obviamente implican a la producción, están indisolublemente interconectados hasta tal punto que aquélla, finalmente no puede darse, realizarse o explicarse sin los otros dos.","En Economía, los conceptos de trabajo y productividad se interconectan. La economía no puede realizarse sin ellos.",Vivian,16.0,5.0,,,,,,,,0
2193,3523_LibroBAC.pdf,"La producción es, pues, el fenómeno que permite obtener un producto o servicio a partir de varios insumos pertinentes que son a su vez materiales o inmateriales.",La producción es el fenómeno que permite obtener un producto o servicio a partir de varios elementos materiales o inmateriales.,Vivian,16.0,17.0,1.0,,,,,,,1
2197,3530_LibroBAC.pdf,Utilidad de forma Existe utilidad de forma cuando mejoramos o aumentamos la capacidad que tenga un producto para producir bienestar al cambiar su forma o apariencia.,La utilidad de forma existe cuando mejoramos la capacidad de un producto para producir bienestar al cambiar su apariencia.,Vivian,17.0,5.0,,,,,,,,0
2202,3560_LibroBAC.pdf,"En esta situación, el auto le es útil ahora y no más tarde, pues sin él puede perder la oportunidad de ese empleo.","Por eso, el carro es útil ahora, pues sin él puede perder la oportunidad de ese empleo.",Vivian,1.0,5.0,,,,,,,,1
2220,3809_LibroBAC.pdf,"Así, pues, el trabajo del ser humano convierte en riqueza los elementos que le ofrecen el suelo, el subsuelo, las aguas y el aire.","Así, el ser humano convierte en riqueza los elementos ofrecidos por el suelo, el subsuelo, las aguas y el aire.",Vivian,16.0,17.0,,,,,,,,0
2226,3826_LibroBAC.pdf,"El beneficio de los minerales y especialmente de los metales; la transformación de la madera y demás productos forestales, la agricultura con sus cultivos, la cría y levante de animales domésticos, el aprovechamiento de la navegación o energía; la pesca, la transformación industrial, la distribución, el transporte y el comercio de los artículos elaborados, todo ello es lo que constituye la riqueza o economía del país.","La riqueza o economía del país se constituye por el beneficio de los minerales. La transformación de la madera y de los productos forestales, la agricultura, el aprovechamiento de la navegación o energía. La pesca, la transformación industrial, la distribución, el transporte y el comercio de los productos.",Vivian,21.0,5.0,19.0,,,,,,,0
2229,3833_LibroBAC.pdf,"Es importante, por lo tanto, continuar los estudios sobre el suelo, el agua, la biota y otros parámetros ambientales importantes que podrían dar información básica para hacer un mejor uso de nuestros recursos y, por consiguiente, de nuestros ecosistemas y de esa manera evitar un daño que pueda tener consecuencias irreparables.","Es importante continuar los estudios sobre el suelo, el agua, la biota y otros aspectos ambientales que dan información para un mejor uso de los recursos y ecosistemas. Esto para evitar daños irreparables.",Vivian,16.0,5.0,,,,,,,,0
2233,3839_LibroBAC.pdf,"Voy a comprar maquinaria que necesito para ampliar el taller que tengo, y en esa forma poder prestar mejores servicios a mis clientes.",Compraré una maquinaria para ampliar mi taller y así dar un mejor servicio a mis clientes.,Vivian,6.0,17.0,,,,,,,,0
2234,3840_LibroBAC.pdf,"Así se podrán reparar más rápido los carros, y se podrá recibir mayor número de los que actualmente se pueden atender.",Así arreglaremos los carros más rápido y en mayor cantidad.,Vivian,6.0,1.0,5.0,,,,,,,1
2235,3841_LibroBAC.pdf,"Y se podrán pagar los impuestos al Estado, para que construya carreteras y atienda otras necesidades, con la esperanza de que también pueda asfaltar las calles del barrio, que se convierten en un lodazal cada vez que llueve.",Y podremos pagar los impuestos al Estado para la construcción de carreteras y atención de otras necesidades.,Vivian,18.0,5.0,,,,,,,,0
2237,3843_LibroBAC.pdf,"El capital está constituido, pues, por los bienes que se usan para producir otros bienes.",Los bienes usados para producir otros bienes forman el capital.,Vivian,5.0,19.0,1.0,,,,,,,1
2238,3846_LibroBAC.pdf,"Artículos como los altos hornos, las prensas cortadoras, los edificios, las computadoras, los camiones, los aviones y otras cosas parecidas se consideran capital; la palabra capital, muchas veces se usa para referirse al dinero, en un sentido bastante estrecho.","Artículos como los altos homos, las prensas cortadoras, los edificios, las computadoras, los camiones, los aviones y otros objetos similares se consideran capital. Aunque la palabra capital a veces se usa para referirse al dinero.",Vivian,5.0,21.0,,,,,,,,0
2239,3848_LibroBAC.pdf,"Esto es correcto desde un punto de vista económico en cuanto el dinero puede usarse para comprar el equipo, los materiales y el trabajo necesarios para producir otros bienes, porque si alguien quiere fabricar zapatos necesita cuero, clavos y martillos.","Esto es correcto desde el punto de vista económico porque el dinero se puede usar para comprar equipo, materiales y trabajo para producir otros bienes. Si alguien fabrica zapatos necesita cuero, clavos y martillos.",Vivian,5.0,6.0,15.0,,,,,,,0
2240,3850_LibroBAC.pdf,"Y una vez que los produzca, necesita un vehículo que los transporte hasta los almacenes que los venden al público.","Una vez hechos, necesita un vehículo para transportarlos hasta los almacenes donde los venderán.",Vivian,5.0,17.0,,,,,,,,0
2246,3860_LibroBAC.pdf,"El empresarialismo es una estrategia que desde hace décadas se desarrolla en países latinoamericanos, centroamericanos y del mundo, especialmente entre los que se conocen como en vías de desarrollo.","El empresarialismo es una estrategia desarrollada en países latinoamericanos, centroamericanos y del mundo, principalmente aquellos en vías de desarrollo.",Vivian,17.0,5.0,,,,,,,,0
2251,3991_LibroBAC.pdf,"Por ejemplo, es el caso de una ladrillera que antes producía mil ladrillos, y ahora produce mil quinientos, sin haber aumentado los costos de producción, entonces las ganancias son mayores y también aumenta el deseo de producir más ladrillos y como la empresa trabaja bien, entonces también tiene mayores pedidos.","Por ejemplo, una ladrillera antes producía mil ladrillos, y ahora produce mil quinientos sin aumentar los costos de producción. Entonces aumentaron las ganancias y el deseo de producir más ladrillos. Además, por el buen trabajo de la empresa aumentaron los pedidos.",Vivian,15.0,17.0,5.0,10.0,,,,,,0
2253,3993_LibroBAC.pdf,"Se ha creado pues en esta fábrica nuevas oportunidades de trabajo, y algunas personas que antes estaban desocupadas encuentran aquí posibilidades de empleo y podrán devengar un salario con el cual puedan atender sus necesidades y las de sus familias.","En esta fábrica se crearon nuevas oportunidades laborales. Así, algunas personas desempleadas encontraron empleo y tendrán un salario para atender sus necesidades y las de sus familias.",Vivian,10.0,5.0,17.0,,,,,,,0
2255,3996_LibroBAC.pdf,"Sin embargo, cuando no hay productividad, o sea, cuando no se utiliza adecuadamente la maquinaria, o los trabajadores son perezosos en su trabajo, o se desperdicia la materia prima, las utilidades son menores e incluso se corre el riesgo de la pérdida.","Sin embargo, cuando no hay productividad las ganancias son menores y hay riesgo de pérdida.",Vivian,5.0,15.0,6.0,1.0,,,,,,1
2263,4009_LibroBAC.pdf,"Con frecuencia en el país la gente se queja del alto costo de vida, especialmente en los últimos tiempos, y esto porque los productos de uso inmediato, así como muchos de los servicios esenciales, aumentan su valor constantemente.",Frecuentemente en el país las personas se quejan del alto costo de la vida porque los productos de uso cotidiano y muchos servicios básicos aumentan su valor constantemente.,Vivian,5.0,15.0,1.0,,,,,,,1
2265,4011_LibroBAC.pdf,"Este costo de vida ha ido en aumento sin que desafortunadamente los salarios o la capacidad adquisitiva de las personas aumenten en la misma proporción, lo que crea en estas mucho pánico e inseguridad explicables.",Este costo de vida ha aumentado sin que los salarios o la capacidad adquisitiva de las personas aumente en la misma proporción.,Vivian,5.0,6.0,,,,,,,,0
2275,4022_LibroBAC.pdf,"Cuando hay abundancia de artículos y precios al alcance de todos los bolsillos y posibilidades de recreación y de ahorro, aumenta el bienestar social de las familias y de las comunidades, porque entonces también hay posibilidad de trabajo para todos y mejores salarios.",El bienestar social de las familias y las comunidades aumenta cuando hay muchos artículos y precios al alcance de todas las personas.,Vivian,15.0,5.0,19.0,1.0,,,,,,1
2286,4046_LibroBAC.pdf,"La producción a que nos estamos refiriendo conduce a la elaboración de bienes económicos y de servicios y un objeto, para que sea bien económico, debe tener características como la tangibilidad, la utilidad, la escasez y la trasferibilidad.","Nos referimos a una producción dirigida a la elaboración de bienes económicos y de servicios. Además, para que un objeto sea un bien económico debe tener las características.",Vivian,17.0,15.0,,,,,,,,0
2287,4048_LibroBAC.pdf,"Cada uno de los factores de producción, como es obvio, tiene un papel decisivo específico en la misma.",Cada factor de producción tiene un papel específico en esta.,Vivian,16.0,4.0,6.0,,,,,,,0
2288,4049a_LibroBAC.pdf,"Por otra parte, en la economía existen los llamados sectores de la producción como son el rural, campesino, agrario o extractivo que se conoce como sector primario; el de la industria que se denomina sector secundario y el del comercio y servicios que es el sector terciario.","Por otra parte, en la economía existen sectores de producción. El sector primario es el rural, campesino o agrario. El sector secundario es la industria. Y el sector terciario es el del comercio y servicios.",Vivian,5.0,21.0,,,,,,,,0
2293,5569_LibroBAC.pdf,"Esto indica no aceptar ofertas a crédito, pedidos por teléfono, así como ofertas por correo.","Es decir, no aceptar ofertas de crédito, pedidos por teléfono u ofertas por correo.",Vivian,4.0,5.0,,,,,,,,0
2302,5589_LibroBAC.pdf,"Esas personas, simplemente, no tienen idea de cómo hacer rendir el dinero y de cómo ahorrar.",Esas personas no saben cómo rendir el dinero o ahorrar.,Vivian,6.0,5.0,16.0,,,,,,,0
2303,5592_LibroBAC.pdf,"Lo importante es que se den en un plan de respeto, con objetividad (ojalá documental cuando sea necesario) y sin imposiciones.","Es importante que se den con respeto, objetividad y sin imposiciones.",Vivian,16.0,6.0,,,,,,,,0
2313,5612_LibroBAC.pdf,"Puede que algunos documentos estén bien guardados en una caja de seguridad, pero otros podrían estar regados descuidada y anárquicamente en una gaveta en la oficina o en la misma casa, e incluso muchos pueden haber ido a la basura.","Algunos documentos pueden estar guardados en una caja de seguridad, pero otros podrían estar tirados en cualquier lugar o en la basura.",Vivian,19.0,5.0,15.0,6.0,,,,,,0
2315,5614_LibroBAC.pdf,"Los documentos debe archivarlos en fólderes o carpetas separados, identificando cada carpeta y organizándola en orden alfabético o por asuntos, en un archivador o caja de seguridad.",Los documentos debe guardarlos en carpetas separadas. Debe identificar cada carpeta y ordenarla en orden alfabético o por asunto en una caja de seguridad o archivador.,Vivian,12.0,15.0,1.0,,,,,,,1
2320,5629_LibroBAC.pdf,"Como ya lo hemos señalado o se puede inferir, el capital de las empresas está constituido por todos los bienes que la empresa tiene como propiedad, los cuales están representados, según el tipo de empresa (grande, mediana o pequeña) y el sector económico a que pertenece (primario, secundario, terciario) por instalaciones (edificios, terrenos u otros), maquinaria, equipos, materias primas, mercancías, fórmulas de productos y tecnología, dinero efectivo, etc.","Como mencionamos, el capital de las empresas está formado por todos sus bienes como propiedad. Estos se representan según el tipo de empresa, el sector económico, por instalaciones, maquinaria, equipos, materias primas, mercancías, fórmulas de productos, tecnología y dinero.",Vivian,5.0,16.0,15.0,1.0,,,,,,1
2323,5632_LibroBAC.pdf,"Las familias a su vez, entregan al aparato productivo fuerza de trabajo, recursos naturales, capitales y conocimientos tecnológicos, conjunto que recibe el nombre de recursos productivos.","Las familias entregan al aparato productivo recursos productivos como fuerza de trabajo, recursos naturales, capitales y conocimientos tecnológicos.",Vivian,5.0,16.0,,,,,,,,0
2325,5634_LibroBAC.pdf,"Las comunidades y las familias contribuyen a su vez a las empresas con el trabajo necesario para la producción de los bienes y servicios, recibiendo a cambio como pago un ingreso en dinero (salarios) que les permite a su vez la adquisición de bienes y servicios ofrecidos por las mismas empresas en el amplio ámbito del mercado.",Las comunidades y las familias contribuyen a las empresas con el trabajo necesario para la producción de los bienes y servicios. A cambio reciben un salario para adquirir bienes y servicios ofrecidos por las mismas empresas en el ámbito del mercado.,Vivian,16.0,6.0,5.0,,,,,,,0
2327,5639_LibroBAC.pdf,"La forma de organización social y económica que los países adopten en la solución del problema económico es lo que se denomina un sistema económico, dándose en éste, a la vez, los llamados agentes económicos que son principalmente el Estado, las comunidades y las familias y las empresas de los tres sectores económicos ya varias veces mencionados.","El sistema económico es la forma de organización social y económica adoptada por los países en la solución de un problema económico. A la vez se dan los agentes económicos como el Estado, las familias, las comunidades y las empresas.",Vivian,15.0,19.0,5.0,,,,,,,0
2328,5640_LibroBAC.pdf,"Naturalmente, que cuanto más grande sea la base de riqueza que tenga una nación con que trabajar, más serán los bienes y servicios que podrá producir, y más alto será su nivel de vida.",Si una nación tiene una base de riqueza grande para trabajar podrá producir más bienes y servicios.,Vivian,9.0,,,,,,,,,0
2334,5649_LibroBAC.pdf,Las contribuciones gravan a los bienes raíces y son proporcionales al avalúo o tasación que hace el Estado de esos bienes.,Las contribuciones gravan las propiedades en proporción con su valor dado por el Estado.,Vivian,1.0,17.0,,,,,,,,1
2339,5657_LibroBAC.pdf,En muchos de estos casos ejerce supervisión de los precios que se cobran.,Supervisa los precios cobrados en estos casos.,Vivian,19.0,17.0,6.0,,,,,,,0
2342,5661_LibroBAC.pdf,"Con la seguridad financiera, que debe ser también objetivo de la educación, se busca fomentar el buen manejo de las finanzas personales para un futuro financiero seguro y mejorar la capacidad de los educadores y educadoras para ofrecer programas efectivos, brindando vitalidad económica y calidad de vida a las familias y a sus comunidades.","La seguridad financiera busca fomentar el buen manejo de las finanzas personales para un futuro seguro. También, mejorar la capacidad de las personas educadoras para ofrecer programas efectivos que promuevan la calidad de vida.",Vivian,15.0,16.0,12.0,1.0,5.0,,,,,1
2352,5675_LibroBAC.pdf,"La objetividad invita a ser concretos en las metas y a analizar el orden de las posibilidades cuando se toman las decisiones que contribuyen o exigen las realidades financieras, en que cada persona está inmersa.",La objetividad invita a precisar las metas y analizar las posibilidades cuando se decide en situaciones financieras.,Vivian,17.0,15.0,5.0,6.0,,,,,,0
2353,5676_LibroBAC.pdf,"Se trata de mirar y analizar cada situación fundamentada en evidencias, información y hechos concretos del acontecer personal y financiero.","Es analizar la situación según las evidencias, información y acciones específicas personales y financieras.",Vivian,6.0,1.0,,,,,,,,1
2357,5681_LibroBAC.pdf,"Si se analiza la vida de las personas que han tenido éxito a lo largo de la existencia, encontraremos que todas han sido incansables trabajadoras, incluso hasta el final mismo de sus días.",Todas las personas exitosas trabajaron incansablemente.,Vivian,5.0,10.0,15.0,,,,,,,0
2358,5682_LibroBAC.pdf,"Si no hay trabajo no puede haber éxito, porque tampoco habrá prosperidad y seguridad financiera.",Sin trabajo no hay éxito ni seguridad financiera.,Vivian,5.0,6.0,,,,,,,,0
2359,5683_LibroBAC.pdf,El trabajar es una responsabilidad que se adquiere desde la familia para que los sueños se hagan realidad.,Trabajar por los sueños es una responsabilidad adquirida desde la familia.,Vivian,17.0,5.0,19.0,,,,,,,0
2377,5718_LibroBAC.pdf,"La persona escéptica, que muchas veces lo que oculta es inseguridad personal, frustración y baja autoestima, nunca está segura de adquirir fortuna o seguridad financiera, de conseguir honores, de prepararse un retiro apacible, de sacar adelante una familia honorablemente, de conservar la casa en perfecto estado, etc. porque son cosas que no dependen exclusivamente de uno mismo.",La persona incrédula nunca está segura de lograr sus metas.,Vivian,1.0,15.0,5.0,,,,,,,1
2378,5721_LibroBAC.pdf,"Entre los estados psicológicos enemigos del optimismo están en primer término los estados afectivos deprimentes como la tristeza, la apatía, la ansiedad o la preocupación.","La tristeza, la apatía, la ansiedad y la preocupación son estados psicológicos enemigos del optimismo.",Vivian,19.0,5.0,,,,,,,,0
2380,5724_LibroBAC.pdf,"Muchas personas, comúnmente, y esto también adviene de la educación recibida, se derrumban o retroceden cuando habiéndose impuesto una meta encuentran el primer obstáculo.",Muchas personas retroceden cuando encuentran el primer obstáculo.,Vivian,16.0,5.0,,,,,,,,0
2381,5725_LibroBAC.pdf,"Esto ocurre con frecuencia con los que ingresan a los negocios, que al ver que después de los tres o seis meses no se cumplen sus expectativas entonces optan por retirarse, sin considerar que los negocios, como muchas metas de la vida, son a largo plazo.",Esto ocurre frecuentemente con quienes inician un negocio porque se retiran cuando no se cumplen sus expectativas después de tres o seis meses.,Vivian,9.0,5.0,16.0,,,,,,,0
2383,5729_LibroBAC.pdf,"Él se volteó, miró a la señora a sus ojos y le replicó: Señora, yo la di.","Él se volteó, miró a la señora a los ojos y le respondió: Señora, yo la di.",Vivian,21.0,1.0,,,,,,,,1
2390,9220_LibroBAC.pdf,"El segundo paso es conocer su flujo de efectivo, es decir, cuáles son los recursos financieros con los que cuenta, ¿cuánto dinero debe?","El segundo paso es conocer cuáles son sus recursos financieros, ¿cuánto dinero debe?",Vivian,21.0,5.0,15.0,,,,,,,0
2395,9227_LibroBAC.pdf,"Para averiguarlo, anote cada dólar que gasta y cada artículo que compra durante un mes.",Anote cada dólar gastado y cada artículo comprado durante un mes para averiguarlo.,Vivian,17.0,19.0,,,,,,,,0
2398,9232_LibroBAC.pdf,¿Está gastando en cosas que no necesita?,Pregúntese si gasta en cosas innecesarias.,Vivian,6.0,17.0,,,,,,,,0
2399,9233_LibroBAC.pdf,Trate de eliminar algunas de las cosas que no necesita.,Elimine algunas cosas innecesarias.,Vivian,6.0,17.0,,,,,,,,0
2406,9249_LibroBAC.pdf,"Ahorro = Ingreso disponible  Consumo El interés es todo aquel provecho, utilidad o beneficio producido por el principal.",El ahorro es el ingreso disponible menos el consumo. El interés es el beneficio producido por el principal.,Vivian,21.0,5.0,,,,,,,,0
2413,9263_LibroBAC.pdf,"El ahorro que una persona puede realizar apartando dinero en forma regular, preferiblemente.","Preferiblemente, el ahorro realizado por una persona regularmente.",Vivian,12.0,17.0,6.0,,,,,,,0
2415,9999_LibroBAC.pdf,"En el lenguaje económico y de la administración de las finanzas, es muy común oír hablar de la inversión, como una modalidad o recurso que le permite a las personas, a las familias, a las empresas y organizaciones e incluso al Estado, poner a trabajar sus ahorros, en función de incrementarlos y aportarle a ellos un valor agregado mediante los intereses, dividendos u otros dineros que se obtienen con la inversión, según sea el tipo o modalidad de inversión por la que se opte.",En el lenguaje económico y de la administración de las finanzas es común escuchar sobre inversión. Como un recurso que les permite a las personas aumentar sus ahorros según la modalidad de inversión escogida.,Vivian,15.0,5.0,17.0,1.0,,,,,,1
2416,10002_LibroBAC.pdf,"Los ingresos que se obtienen a nivel personal, familiar, comunitario y de país pueden, si el consumo es menor, generar ahorros que pueden incrementarse si son utilizados en instrumentos de inversión, dando como resultados una rentabilidad que garantice mejores condiciones de vida y un mayor impacto en el desarrollo económico y social del país.","Los ingresos obtenidos a nivel personal, familiar, comunitarios y nacional generan ahorros sin son invertidos. Los resultados de esto pueden garantizar mejores condiciones de vida.",Vivian,15.0,17.0,12.0,5.0,,,,,,0
2417,10003_LibroBAC.pdf,"En este Libro Maestro se trata de cubrir los aspectos conceptuales sobre las inversiones como instrumento para incrementar los ahorros, así como resaltar la importancia de la inversión en el logro de la libertad financiera.","En este Libro Maestro se estudian los conceptos sobre las inversiones como instrumento para incrementar los ahorros. Además, se resalta la importancia de la inversión en el logro de la libertad financiera.",Vivian,6.0,4.0,8.0,,,,,,,0
2418,10005_LibroBAC.pdf,"así como se desarrollan los tipos e instrumentos de inversión, incluyendo las instituciones o sociedades de inversión y los portafolios de inversión, de la manera más completa posible, considerando las informaciones que se encuentran disponibles, principalmente en instituciones de sistemas financieros, así como de otras informaciones que se señalan en la bibliografía consultada.","Además, se desarrollan tipos e instrumentos de inversión. Para esto, se considera la información disponible en instituciones de sistemas financieros y en la bibliografía consultada.",Vivian,15.0,5.0,12.0,,,,,,,0
2420,10011_LibroBAC.pdf,"Se observa, claramente, la importancia de la inversión en la educación para el logro de la libertad financiera.",Observamos la importancia de la inversión en la educación para conseguir la libertad financiera.,Vivian,16.0,6.0,,,,,,,,0
2425,10023_LibroBAC.pdf,Otros conceptos importantes se refieren a la utilidad (ganancia) y rentabilidad.,Otros conceptos se refieren a la ganancia y rentabilidad.,Vivian,5.0,6.0,,,,,,,,0
2427,10025_LibroBAC.pdf,"Una inversión, en términos generales, es la utilización de recursos en el sector productivo o de capitales con el objetivo de lograr beneficios o ganancias orientadas al logro de la libertad financiera.",Una inversión es la utilización de recursos en el sector productivo para lograr ganancias orientadas hacia la libertad financiera.,Vivian,16.0,5.0,6.0,,,,,,,0
2433,10037_LibroBAC.pdf,Los intereses corresponden a pagos que se realizan por la utilización de dinero por un cierto plazo.,Los intereses son pagos realizados por el uso del dinero por un cierto tiempo.,Vivian,17.0,6.0,1.0,,,,,,,1
2448,10067_LibroBAC.pdf,"La primera etapa consiste en realizar un diagnóstico para conocer la situación en relación con los recursos, si son suficientes, si la utilización de parte o del total del dinero disponible no acarreará problemas para atender las necesidades o los consumos necesarios, por cuanto tiempo se pueden invertir los ahorros o recursos financieros, reunir las informaciones para la adopción de decisiones acertadas de las inversiones por realizar; así como otros temas que podrían ser útiles.","La primera etapa consiste en hacer un diagnóstico para conocer los ahorros disponibles. Es decir, si son suficientes y por cuanto tiempo se pueden invertir.",Vivian,15.0,5.0,1.0,,,,,,,1
2467,10100_LibroBAC.pdf,La reunión entonces se ha convertido en una magnitud psicológica.,La reunión se convirtió en una dimensión psicológica.,Vivian,10.0,1.0,,,,,,,,1
2473,10109_LibroBAC.pdf,Contar con informaciones de seguridad financiera es muy importante en el campo de la inversión.,En la inversión es importante informarse sobre seguridad financiera.,Vivian,19.0,6.0,,,,,,,,0
